{
  "schema_version": "sp.geometry/1.0",
  "geometry_id": "ring.path.0",
  "source_region": "ring",
  "kind": "path",
  "points": [
    {
      "x": -10000,
      "z": 0
    },
    {
      "x": -9375,
      "z": 490
    },
    {
      "x": -8750,
      "z": 975
    },
    {
      "x": -8125,
      "z": 1451
    },
    {
      "x": -7500,
      "z": 1913
    },
    {
      "x": -6875,
      "z": 2356
    },
    {
      "x": -6250,
      "z": 2777
    },
    {
      "x": -5625,
      "z": 3171
    },
    {
      "x": -5000,
      "z": 3535
    },
    {
      "x": -4375,
      "z": 3865
    },
    {
      "x": -3750,
      "z": 4157
    },
    {
      "x": -3125,
      "z": 4409
    },
    {
      "x": -2500,
      "z": 4619
    },
    {
      "x": -1875,
      "z": 4784
    },
    {
      "x": -1250,
      "z": 4903
    },
    {
      "x": -625,
      "z": 4975
    },
    {
      "x": 0,
      "z": 5000
    },
    {
      "x": 625,
      "z": 4975
    },
    {
      "x": 1250,
      "z": 4903
    },
    {
      "x": 1875,
      "z": 4784
    },
    {
      "x": 2500,
      "z": 4619
    },
    {
      "x": 3125,
      "z": 4409
    },
    {
      "x": 3750,
      "z": 4157
    },
    {
      "x": 4375,
      "z": 3865
    },
    {
      "x": 5000,
      "z": 3535
    },
    {
      "x": 5625,
      "z": 3171
    },
    {
      "x": 6250,
      "z": 2777
    },
    {
      "x": 6875,
      "z": 2356
    },
    {
      "x": 7500,
      "z": 1913
    },
    {
      "x": 8125,
      "z": 1451
    },
    {
      "x": 8750,
      "z": 975
    },
    {
      "x": 9375,
      "z": 490
    },
    {
      "x": 10000,
      "z": 0
    }
  ],
  "mask_file": null,
  "width_px": 0,
  "height_px": 0,
  "source_pixel_sha256": "c0ab8db450d29cc894f3a78e92a88be815d0b49e26380b4c6566759d06fbcd13",
  "algorithm": "illustrative_fixture_not_extracted",
  "notes": "Fixture manuelle de contrat. La géométrie n’est pas une sortie mesurée du résolveur et le dessin ne constitue pas un journal de capture de production."
}
